{
  "manifestVersion": 1,
  "sourceRepository": "projectathena/docs",
  "slugLockPolicy": {
    "publishedSlugImmutable": true,
    "renameHandling": "Keep existing destinationSlug. Update sourcePath only and retain old route.",
    "removedSourceHandling": "Retain generated page for one deprecation cycle, then archive with replacement link when available."
  },
  "entries": [
    {
      "id": "athena-runtime-agent-orchestration-lifecycle",
      "domain": "runtime-control-plane",
      "sourcePath": "user/01-introduction.md",
      "destinationSlug": "reference/athena-agent-orchestration-lifecycle",
      "owner": {
        "team": "Athena Runtime",
        "reviewers": [
          "@athena-runtime",
          "@website-docs"
        ]
      },
      "lifecycleState": "in_review",
      "slugLocked": true,
      "notes": "Detailed lifecycle model for specialists."
    },
    {
      "id": "athena-runtime-control-plane-overview",
      "domain": "runtime-control-plane",
      "sourcePath": "user/01-introduction.md",
      "destinationSlug": "reference/athena-control-plane-overview",
      "owner": {
        "team": "Athena Runtime",
        "reviewers": [
          "@athena-runtime",
          "@website-docs"
        ]
      },
      "lifecycleState": "in_review",
      "slugLocked": true,
      "notes": "Control plane architecture overview."
    },
    {
      "id": "athena-security-identity-and-authn",
      "domain": "security-and-identity",
      "sourcePath": "user/04-api-server.md",
      "destinationSlug": "reference/athena-identity-and-authn",
      "owner": {
        "team": "Athena Security",
        "reviewers": [
          "@athena-security",
          "@website-docs"
        ]
      },
      "lifecycleState": "in_review",
      "slugLocked": true,
      "notes": "Identity and authentication model."
    },
    {
      "id": "athena-observability-audit-events",
      "domain": "observability",
      "sourcePath": "user/04-api-server.md",
      "destinationSlug": "reference/athena-audit-events",
      "owner": {
        "team": "Athena Platform",
        "reviewers": [
          "@athena-platform",
          "@website-docs"
        ]
      },
      "lifecycleState": "in_review",
      "slugLocked": true,
      "notes": "Audit event taxonomy and evidence collection."
    },
    {
      "id": "athena-api-mission-run-endpoint",
      "domain": "api-reference",
      "sourcePath": "user/04-api-server.md",
      "destinationSlug": "reference/athena-api-mission-run-endpoint",
      "owner": {
        "team": "Athena API",
        "reviewers": [
          "@athena-api",
          "@website-docs"
        ]
      },
      "lifecycleState": "in_review",
      "slugLocked": true,
      "notes": "Mission execution API contract."
    }
  ]
}
